{
  "schemaVersion": 1,
  "id": "N0-U06",
  "levelId": "N0",
  "order": 6,
  "title": "Usando a língua no cotidiano",
  "objective": "Compreender e produzir mensagens breves em situações cotidianas, considerando interlocutor, finalidade e contexto; usar perguntas, respostas, pedidos, ofertas, orientações, avisos e estratégias de esclarecimento; reconhecer adequação formal e informal e a variação do português sem transformar diferenças de uso, sotaque ou variedade em erro automático.",
  "competencies": [
    {
      "id": "N0-U06-C01",
      "label": "identificar quem comunica, para quem e com qual finalidade imediata em situações cotidianas simples"
    },
    {
      "id": "N0-U06-C02",
      "label": "formular perguntas simples para obter informação necessária em situações cotidianas"
    },
    {
      "id": "N0-U06-C03",
      "label": "responder perguntas simples e fornecer informação suficiente para a necessidade apresentada"
    },
    {
      "id": "N0-U06-C04",
      "label": "compreender e produzir pedidos, ofertas e orientações simples adequados à situação"
    },
    {
      "id": "N0-U06-C05",
      "label": "compreender avisos, instruções e mensagens cotidianas pelo conteúdo, finalidade e ação esperada"
    },
    {
      "id": "N0-U06-C06",
      "label": "compreender a informação principal de mensagens orais curtas, usando repetição quando necessário sem depender de transcrição prévia"
    },
    {
      "id": "N0-U06-C07",
      "label": "escolher formulações mais formais ou mais informais conforme situação e interlocutor sem hierarquia automática de valor"
    },
    {
      "id": "N0-U06-C08",
      "label": "reconhecer variação do português entre pessoas, lugares, grupos e situações sem tratar diferença como erro automático"
    },
    {
      "id": "N0-U06-C09",
      "label": "usar repetição, esclarecimento e confirmação como estratégias legítimas de reparo comunicativo"
    },
    {
      "id": "N0-U06-C10",
      "label": "reformular mensagens simples e confirmar se a comunicação funcionou, com ensaio oral separado da validação de compreensibilidade"
    }
  ],
  "prerequisites": [
    "N0-U05-V01"
  ],
  "lessons": [
    {
      "id": "N0-U06-L01",
      "order": 1,
      "title": "Quem, para quem e para quê?",
      "path": "lessons/001-quem-para-quem-para-que.json",
      "competencyIds": [
        "N0-U06-C01"
      ]
    },
    {
      "id": "N0-U06-L02",
      "order": 2,
      "title": "Perguntar para obter informação",
      "path": "lessons/002-perguntar-para-obter-informacao.json",
      "competencyIds": [
        "N0-U06-C02"
      ]
    },
    {
      "id": "N0-U06-L03",
      "order": 3,
      "title": "Responder e fornecer informação",
      "path": "lessons/003-responder-e-fornecer-informacao.json",
      "competencyIds": [
        "N0-U06-C03"
      ]
    },
    {
      "id": "N0-U06-L04",
      "order": 4,
      "title": "Pedir, oferecer e orientar",
      "path": "lessons/004-pedir-oferecer-orientar.json",
      "competencyIds": [
        "N0-U06-C04"
      ]
    },
    {
      "id": "N0-U06-L05",
      "order": 5,
      "title": "Avisos, instruções e mensagens do cotidiano",
      "path": "lessons/005-avisos-instrucoes-mensagens-cotidiano.json",
      "competencyIds": [
        "N0-U06-C05"
      ]
    },
    {
      "id": "N0-U06-L06",
      "order": 6,
      "title": "Ouvindo mensagens curtas e identificando o principal",
      "path": "lessons/006-ouvindo-mensagens-curtas.json",
      "competencyIds": [
        "N0-U06-C06"
      ]
    },
    {
      "id": "N0-U06-L07",
      "order": 7,
      "title": "Mais formal ou mais informal?",
      "path": "lessons/007-mais-formal-ou-mais-informal.json",
      "competencyIds": [
        "N0-U06-C07"
      ]
    },
    {
      "id": "N0-U06-L08",
      "order": 8,
      "title": "Maneiras diferentes de usar o português",
      "path": "lessons/008-maneiras-diferentes-de-usar-o-portugues.json",
      "competencyIds": [
        "N0-U06-C08"
      ]
    },
    {
      "id": "N0-U06-L09",
      "order": 9,
      "title": "Quando não entendo: repetir, esclarecer e confirmar",
      "path": "lessons/009-quando-nao-entendo-repetir-esclarecer-confirmar.json",
      "competencyIds": [
        "N0-U06-C09"
      ]
    },
    {
      "id": "N0-U06-L10",
      "order": 10,
      "title": "Reformular e confirmar que a comunicação funcionou",
      "path": "lessons/010-reformular-e-confirmar-comunicacao.json",
      "competencyIds": [
        "N0-U06-C10"
      ]
    }
  ],
  "verification": {
    "id": "N0-U06-V01",
    "path": "integrated-verification.json",
    "competencyIds": [
      "N0-U06-C01",
      "N0-U06-C02",
      "N0-U06-C03",
      "N0-U06-C04",
      "N0-U06-C05",
      "N0-U06-C06",
      "N0-U06-C07",
      "N0-U06-C08",
      "N0-U06-C09",
      "N0-U06-C10"
    ]
  },
  "publication": {
    "status": "READY",
    "blockers": []
  }
}
